{
  "schema_version": "0.1",
  "kind": "idkmesh-human-decision-record",
  "decision_id": "decision/example-1",
  "evidence_report": {
    "kind": "idkmesh-run-evidence-report",
    "schema_version": "0.1",
    "run_id": "run/example-1",
    "digest": "sha256:074e0ceef724000e6f628f854fedc6d918ced24d4caea73f8cc31b1f0ac4edd8"
  },
  "selected_attempt_id": "attempt/example-1-2",
  "decision": "accept",
  "rationale": "The second attempt is independently verified with every required check passing while the first attempt failed at the worker, so its candidate is the integration choice; executing that integration remains a separate, authorized step.",
  "decider": {
    "id": "maintainer/example",
    "type": "human",
    "display_name": "Example Maintainer"
  },
  "decided_at": "2026-10-01T00:02:00Z",
  "authority": {
    "canonical_state_write": false,
    "git_push": false,
    "merge": false
  }
}
